{"id":"EVD-META0001","type":"receipt","title":"Unavailable historical receipt","status":"missing-file","storageMode":"metadata-only","createdAt":"2026-07-28T00:00:00.000Z","updatedAt":"2026-07-28T00:00:00.000Z","provenance":"previous-owner","confidence":"low","revisionHistory":[],"archiveState":{"archived":false}}
