{"id":"EVD-PDF00001","type":"document","title":"Synthetic PDF metadata","status":"reviewed","mimeType":"application/pdf","originalFileName":"test.pdf","fileExtension":"pdf","fileSize":5,"checksum":"bbbbbbbbbbbbbbbbbbbbbbbbbbbbbbbbbbbbbbbbbbbbbbbbbbbbbbbbbbbbbbbb","storageMode":"indexeddb","storageKey":"EVF-PDF","createdAt":"2026-07-28T00:00:00.000Z","updatedAt":"2026-07-28T00:00:00.000Z","provenance":"owner-imported","confidence":"medium","revisionHistory":[],"archiveState":{"archived":false}}
