{"id":"EVD-PHOTO001","type":"photograph","title":"Synthetic test photograph","status":"active","mimeType":"image/jpeg","originalFileName":"test.jpg","fileExtension":"jpg","fileSize":4,"checksum":"aaaaaaaaaaaaaaaaaaaaaaaaaaaaaaaaaaaaaaaaaaaaaaaaaaaaaaaaaaaaaaaa","storageMode":"indexeddb","storageKey":"EVF-TEST","createdAt":"2026-07-28T00:00:00.000Z","updatedAt":"2026-07-28T00:00:00.000Z","provenance":"owner-captured","confidence":"high","tags":[],"systemIds":[],"componentIds":[],"relatedRecordIds":[],"revisionHistory":[],"archiveState":{"archived":false},"metadata":{}}
